{
  "manifest_version": "1.0",
  "workspace": "D:/Sources/Github/forgewright",
  "forgewright": {
    "version": "8.2.0",
    "canonical": "C:/Users/buiph/.forgewright",
    "server": "C:/Users/buiph/.forgewright/mcp-server/src/index.ts"
  },
  "servers": [
    {
      "name": "forgewright",
      "type": "forgewright-mcp-server",
      "path": "C:/Users/buiph/.forgewright/mcp-server/src/index.ts",
      "enabled": true,
      "auto_start": true
    },
    {
      "name": "gitnexus",
      "type": "gitnexus",
      "command": "gitnexus",
      "args": ["mcp"],
      "enabled": true,
      "auto_start": true
    }
  ],
  "settings": {
    "mcp_compatibility": "loose",
    "workspace_detection": "git-root"
  },
  "platforms": {
    "cursor": "C:/Users/buiph/.cursor/mcp.json",
    "claude_code": "C:/Users/buiph/.claude/settings.json",
    "antigravity": "not_found"
  },
  "generated_at": "2026-07-01T11:41:00Z"
}
